{
  "schema": "sico.semantic-index.v0",
  "protocol_version": 0,
  "producer": { "name": "sico-semantic-fixture", "version": "0", "mode": "fixture" },
  "snapshot": {
    "id": "fixture:semantic-query-v0",
    "quality": { "state": "partial", "reasons": ["fixture_scope"], "blocked_by": [] }
  },
  "package": { "id": "sico://examples/package", "name": "examples", "version": "0.0.0-fixture" },
  "modules": [
    {
      "id": "sico://examples/hello",
      "name": "hello",
      "source_file": "examples/hello.sico",
      "quality": { "state": "partial", "reasons": ["outline_only"], "blocked_by": [] },
      "facets": { "purpose": { "basis": "inferred", "value": "write a greeting to the console", "evidence": [{ "kind": "analysis", "ref": "fixture:module-outline" }] } }
    },
    {
      "id": "sico://examples/calculator",
      "name": "calculator",
      "source_file": "examples/calculator/candidate-a.sico",
      "quality": { "state": "partial", "reasons": ["outline_only"], "blocked_by": [] },
      "facets": { "purpose": { "basis": "inferred", "value": "evaluate calculator operations with typed errors", "evidence": [{ "kind": "analysis", "ref": "fixture:module-outline" }] } }
    },
    {
      "id": "sico://examples/order-state",
      "name": "order-state",
      "source_file": "examples/order-state/candidate-a.sico",
      "quality": { "state": "partial", "reasons": ["selected_symbols_only"], "blocked_by": [] },
      "facets": { "purpose": { "basis": "inferred", "value": "validate closed order state transitions", "evidence": [{ "kind": "analysis", "ref": "fixture:module-outline" }] } }
    },
    {
      "id": "sico://examples/account-transfer",
      "name": "account-transfer",
      "source_file": "examples/account-transfer/candidate-a.sico",
      "quality": { "state": "partial", "reasons": ["selected_symbols_only"], "blocked_by": [] },
      "facets": { "purpose": { "basis": "inferred", "value": "apply and persist account transfers", "evidence": [{ "kind": "analysis", "ref": "fixture:module-outline" }] } }
    },
    {
      "id": "sico://examples/todo-store",
      "name": "todo-store",
      "source_file": "examples/todo-store/candidate-a.sico",
      "quality": { "state": "partial", "reasons": ["outline_only"], "blocked_by": [] },
      "facets": { "purpose": { "basis": "inferred", "value": "store and update todo items", "evidence": [{ "kind": "analysis", "ref": "fixture:module-outline" }] } }
    },
    {
      "id": "sico://examples/word-count",
      "name": "word-count",
      "source_file": "examples/word-count/candidate-a.sico",
      "quality": { "state": "partial", "reasons": ["outline_only"], "blocked_by": [] },
      "facets": { "purpose": { "basis": "inferred", "value": "count Unicode words from a bounded stream", "evidence": [{ "kind": "analysis", "ref": "fixture:module-outline" }] } }
    },
    {
      "id": "sico://examples/http-service",
      "name": "http-service",
      "source_file": "examples/http-service/candidate-a.sico",
      "quality": { "state": "partial", "reasons": ["outline_only"], "blocked_by": [] },
      "facets": { "purpose": { "basis": "inferred", "value": "handle typed asynchronous HTTP routes", "evidence": [{ "kind": "analysis", "ref": "fixture:module-outline" }] } }
    },
    {
      "id": "sico://examples/concurrent-fetch",
      "name": "concurrent-fetch",
      "source_file": "examples/concurrent-fetch/candidate-a.sico",
      "quality": { "state": "partial", "reasons": ["outline_only"], "blocked_by": [] },
      "facets": { "purpose": { "basis": "inferred", "value": "fetch URLs with bounded structured concurrency", "evidence": [{ "kind": "analysis", "ref": "fixture:module-outline" }] } }
    },
    {
      "id": "sico://examples/component-plugin",
      "name": "component-plugin",
      "source_file": "examples/component-plugin/candidate-a.sico",
      "quality": { "state": "partial", "reasons": ["outline_only"], "blocked_by": [] },
      "facets": { "purpose": { "basis": "inferred", "value": "call a versioned Component interface", "evidence": [{ "kind": "analysis", "ref": "fixture:module-outline" }] } }
    },
    {
      "id": "sico://examples/notes-ui",
      "name": "notes-ui",
      "source_file": "examples/notes-ui/candidate-a.sico",
      "quality": { "state": "partial", "reasons": ["outline_only"], "blocked_by": [] },
      "facets": { "purpose": { "basis": "inferred", "value": "update revision-aware note UI state", "evidence": [{ "kind": "analysis", "ref": "fixture:module-outline" }] } }
    }
  ],
  "symbols": [
    {
      "id": "sico://examples/order-state/enum/OrderStatus",
      "module_id": "sico://examples/order-state",
      "kind": "enum",
      "name": "OrderStatus",
      "visibility": "private",
      "source": { "file": "examples/order-state/candidate-a.sico", "range": { "start": { "byte": 90, "line": 2, "column": 6 }, "end": { "byte": 101, "line": 2, "column": 17 } } },
      "quality": { "state": "complete", "reasons": [], "blocked_by": [] },
      "facets": { "variants": { "basis": "declared", "value": ["Draft", "PendingPayment", "Paid", "Shipped", "Cancelled"], "evidence": [{ "kind": "source", "ref": "examples/order-state/candidate-a.sico#bytes=90-155" }] } }
    },
    {
      "id": "sico://examples/order-state/enum/OrderStatus/variant/Draft",
      "module_id": "sico://examples/order-state",
      "kind": "enum-variant",
      "name": "Draft",
      "visibility": "private",
      "source": { "file": "examples/order-state/candidate-a.sico", "range": { "start": { "byte": 104, "line": 3, "column": 3 }, "end": { "byte": 109, "line": 3, "column": 8 } } },
      "quality": { "state": "complete", "reasons": [], "blocked_by": [] },
      "facets": { "parent": { "basis": "declared", "value": "sico://examples/order-state/enum/OrderStatus", "evidence": [{ "kind": "source", "ref": "examples/order-state/candidate-a.sico#bytes=104-109" }] } }
    },
    {
      "id": "sico://examples/order-state/enum/OrderStatus/variant/PendingPayment",
      "module_id": "sico://examples/order-state",
      "kind": "enum-variant",
      "name": "PendingPayment",
      "visibility": "private",
      "source": { "file": "examples/order-state/candidate-a.sico", "range": { "start": { "byte": 112, "line": 4, "column": 3 }, "end": { "byte": 126, "line": 4, "column": 17 } } },
      "quality": { "state": "complete", "reasons": [], "blocked_by": [] },
      "facets": { "parent": { "basis": "declared", "value": "sico://examples/order-state/enum/OrderStatus", "evidence": [{ "kind": "source", "ref": "examples/order-state/candidate-a.sico#bytes=112-126" }] } }
    },
    {
      "id": "sico://examples/order-state/enum/OrderStatus/variant/Paid",
      "module_id": "sico://examples/order-state",
      "kind": "enum-variant",
      "name": "Paid",
      "visibility": "private",
      "source": { "file": "examples/order-state/candidate-a.sico", "range": { "start": { "byte": 129, "line": 5, "column": 3 }, "end": { "byte": 133, "line": 5, "column": 7 } } },
      "quality": { "state": "complete", "reasons": [], "blocked_by": [] },
      "facets": { "parent": { "basis": "declared", "value": "sico://examples/order-state/enum/OrderStatus", "evidence": [{ "kind": "source", "ref": "examples/order-state/candidate-a.sico#bytes=129-133" }] } }
    },
    {
      "id": "sico://examples/order-state/enum/OrderStatus/variant/Shipped",
      "module_id": "sico://examples/order-state",
      "kind": "enum-variant",
      "name": "Shipped",
      "visibility": "private",
      "source": { "file": "examples/order-state/candidate-a.sico", "range": { "start": { "byte": 136, "line": 6, "column": 3 }, "end": { "byte": 143, "line": 6, "column": 10 } } },
      "quality": { "state": "complete", "reasons": [], "blocked_by": [] },
      "facets": { "parent": { "basis": "declared", "value": "sico://examples/order-state/enum/OrderStatus", "evidence": [{ "kind": "source", "ref": "examples/order-state/candidate-a.sico#bytes=136-143" }] } }
    },
    {
      "id": "sico://examples/order-state/enum/OrderStatus/variant/Cancelled",
      "module_id": "sico://examples/order-state",
      "kind": "enum-variant",
      "name": "Cancelled",
      "visibility": "private",
      "source": { "file": "examples/order-state/candidate-a.sico", "range": { "start": { "byte": 146, "line": 7, "column": 3 }, "end": { "byte": 155, "line": 7, "column": 12 } } },
      "quality": { "state": "complete", "reasons": [], "blocked_by": [] },
      "facets": { "parent": { "basis": "declared", "value": "sico://examples/order-state/enum/OrderStatus", "evidence": [{ "kind": "source", "ref": "examples/order-state/candidate-a.sico#bytes=146-155" }] } }
    },
    {
      "id": "sico://examples/order-state/enum/OrderEvent",
      "module_id": "sico://examples/order-state",
      "kind": "enum",
      "name": "OrderEvent",
      "visibility": "private",
      "source": { "file": "examples/order-state/candidate-a.sico", "range": { "start": { "byte": 245, "line": 11, "column": 6 }, "end": { "byte": 255, "line": 11, "column": 16 } } },
      "quality": { "state": "complete", "reasons": [], "blocked_by": [] },
      "facets": { "variants": { "basis": "declared", "value": ["Submit", "Pay", "Ship", "Cancel"], "evidence": [{ "kind": "source", "ref": "examples/order-state/candidate-a.sico#bytes=245-286" }] } }
    },
    {
      "id": "sico://examples/order-state/enum/OrderEvent/variant/Submit",
      "module_id": "sico://examples/order-state",
      "kind": "enum-variant",
      "name": "Submit",
      "visibility": "private",
      "source": { "file": "examples/order-state/candidate-a.sico", "range": { "start": { "byte": 258, "line": 12, "column": 3 }, "end": { "byte": 264, "line": 12, "column": 9 } } },
      "quality": { "state": "complete", "reasons": [], "blocked_by": [] },